{
  "$schema": "https://json-schema.org/draft/2020-12/schema",
  "$id": "https://llm-collab.dev/schemas/standalone/v1/event-envelope.schema.json",
  "title": "EventEnvelopeV1",
  "description": "Bounded adapter input only. Runner identity, subscription revision, receive time, content hash, routing, delivery, retry, registry implementation, and execution authority are deliberately absent. Canonical envelope bytes use the same frozen UTF-8, Unicode-code-point key ordering, array-order, compact-separator, exact-Unicode-scalar, safe-integer-only JSON algorithm described by StateEvidenceV1, including normalization of integer lexical -0 to JSON integer 0 before hashing. The semantic gate recursively applies Unicode NFKC first, then acronym-to-word and ordinary camel-case splitting, then casefolding and separator collapse before enforcing the complete forbidden-authority family.",
  "type": "object",
  "additionalProperties": false,
  "required": ["schema_version", "adapter_name", "adapter_version", "event_type", "source_event_id", "source_cursor", "observed_at_utc", "subject", "coalescing_key", "observed_state", "expected_outcome", "why_not_done", "next_unlock_action", "severity", "payload"],
  "properties": {
    "schema_version": {"const": 1},
    "adapter_name": {"$ref": "#/$defs/token"},
    "adapter_version": {"$ref": "#/$defs/token"},
    "event_type": {"$ref": "#/$defs/token"},
    "source_event_id": {"$ref": "#/$defs/shortText"},
    "source_cursor": {"type": "string", "minLength": 1, "maxLength": 2048, "pattern": "^(?!.*[\\u0000-\\u001f\\u007f\\u0085\\u2028\\u2029]).+$"},
    "observed_at_utc": {"type": "string", "format": "date-time"},
    "source_time_utc": {"type": ["string", "null"], "format": "date-time"},
    "subject": {"type": "string", "minLength": 1, "maxLength": 256, "pattern": "^(?!.*[\\u0000-\\u001f\\u007f\\u0085\\u2028\\u2029]).+$"},
    "coalescing_key": {"type": "string", "minLength": 1, "maxLength": 256, "pattern": "^(?!.*[\\u0000-\\u001f\\u007f\\u0085\\u2028\\u2029]).+$"},
    "observed_state": {"$ref": "#/$defs/shortText"},
    "expected_outcome": {"$ref": "#/$defs/shortText"},
    "why_not_done": {"type": "string", "minLength": 1, "maxLength": 1024, "pattern": "^(?!.*[\\u0000-\\u001f\\u007f\\u0085\\u2028\\u2029]).+$"},
    "next_unlock_action": {"type": "string", "minLength": 1, "maxLength": 1024, "pattern": "^(?!.*[\\u0000-\\u001f\\u007f\\u0085\\u2028\\u2029]).+$"},
    "severity": {"enum": ["quiet", "actionable", "warning", "error"]},
    "payload": {"$ref": "#/$defs/dataObject5"}
  },
  "$defs": {
    "token": {"type": "string", "pattern": "^(?!.*[\\u0000-\\u001f\\u007f\\u0085\\u2028\\u2029])[A-Za-z][A-Za-z0-9._-]{0,127}$"},
    "shortText": {"type": "string", "minLength": 1, "maxLength": 512, "pattern": "^(?!.*[\\u0000-\\u001f\\u007f\\u0085\\u2028\\u2029]).+$"},
    "dataString": {"type": "string", "maxLength": 4096, "pattern": "^(?!.*[\\u0000-\\u001f\\u007f\\u0085\\u2028\\u2029\\ud800-\\udfff]).*$"},
    "dataScalar": {
      "anyOf": [
        {"$ref": "#/$defs/dataString"},
        {"type": "integer", "minimum": -9007199254740991, "maximum": 9007199254740991},
        {"type": "boolean"},
        {"type": "null"}
      ]
    },
    "safePropertyName": {
      "type": "string",
      "description": "Payload keys are rejected when they are an exact reserved authority spelling or a separator-free compact spelling after ASCII/fullwidth case equivalence. The semantic validator additionally applies full Unicode NFKC, acronym/camel splitting, casefolding, and separator collapse.",
      "minLength": 1,
      "maxLength": 128,
      "pattern": "^(?!.*[\\u0000-\\u001f\\u007f\\u0085\\u2028\\u2029\\ud800-\\udfff])(?!(?:[aA锝侊肌][dD锝勶激][aA锝侊肌][pP锝愶及][tT锝旓即][eE锝咃讥][rR锝掞疾]|[aA锝侊肌][dD锝勶激][aA锝侊肌][pP锝愶及][tT锝旓即][eE锝咃讥][rR锝掞疾][iI锝夛缉][mM锝嶏辑][pP锝愶及][lL锝岋棘][eE锝咃讥][mM锝嶏辑][eE锝咃讥][nN锝庯籍][tT锝旓即][aA锝侊肌][tT锝旓即][iI锝夛缉][oO锝忥集][nN锝庯籍]|[aA锝侊肌][dD锝勶激][aA锝侊肌][pP锝愶及][tT锝旓即][eE锝咃讥][rR锝掞疾][nN锝庯籍][aA锝侊肌][mM锝嶏辑][eE锝咃讥]|[aA锝侊肌][dD锝勶激][aA锝侊肌][pP锝愶及][tT锝旓即][eE锝咃讥][rR锝掞疾][rR锝掞疾][eE锝咃讥][vV锝栵级][iI锝夛缉][sS锝擄汲][iI锝夛缉][oO锝忥集][nN锝庯籍]|[aA锝侊肌][dD锝勶激][aA锝侊肌][pP锝愶及][tT锝旓即][eE锝咃讥][rR锝掞疾][vV锝栵级][eE锝咃讥][rR锝掞疾][sS锝擄汲][iI锝夛缉][oO锝忥集][nN锝庯籍]|[aA锝侊肌][gG锝囷姬][eE锝咃讥][nN锝庯籍][tT锝旓即]|[aA锝侊肌][gG锝囷姬][eE锝咃讥][nN锝庯籍][tT锝旓即][iI锝夛缉][dD锝勶激]|[aA锝侊肌][gG锝囷姬][eE锝咃讥][nN锝庯籍][tT锝旓即][sS锝擄汲]|[cC锝冿迹][aA锝侊肌][pP锝愶及][aA锝侊肌][bB锝傦饥][iI锝夛缉][lL锝岋棘][iI锝夛缉][tT锝旓即][yY锝欙脊][pP锝愶及][oO锝忥集][lL锝岋棘][iI锝夛缉][cC锝冿迹][yY锝欙脊]|[cC锝冿迹][aA锝侊肌][pP锝愶及][aA锝侊肌][bB锝傦饥][iI锝夛缉][lL锝岋棘][iI锝夛缉][tT锝旓即][yY锝欙脊][pP锝愶及][rR锝掞疾][oO锝忥集][fF锝嗭鸡][iI锝夛缉][lL锝岋棘][eE锝咃讥]|[cC锝冿迹][aA锝侊肌][pP锝愶及][aA锝侊肌][bB锝傦饥][iI锝夛缉][lL锝岋棘][iI锝夛缉][tT锝旓即][yY锝欙脊][pP锝愶及][rR锝掞疾][oO锝忥集][fF锝嗭鸡][iI锝夛缉][lL锝岋棘][eE锝咃讥][iI锝夛缉][dD锝勶激]|[cC锝冿迹][aA锝侊肌][pP锝愶及][aA锝侊肌][bB锝傦饥][iI锝夛缉][lL锝岋棘][iI锝夛缉][tT锝旓即][yY锝欙脊][pP锝愶及][rR锝掞疾][oO锝忥集][fF锝嗭鸡][iI锝夛缉][lL锝岋棘][eE锝咃讥][rR锝掞疾][eE锝咃讥][vV锝栵级][iI锝夛缉][sS锝擄汲][iI锝夛缉][oO锝忥集][nN锝庯籍]|[cC锝冿迹][aA锝侊肌][pP锝愶及][aA锝侊肌][bB锝傦饥][iI锝夛缉][lL锝岋棘][iI锝夛缉][tT锝旓即][yY锝欙脊][pP锝愶及][rR锝掞疾][oO锝忥集][fF锝嗭鸡][iI锝夛缉][lL锝岋棘][eE锝咃讥][sS锝擄汲]|[cC锝冿迹][hH锝堬绩][aA锝侊肌][tT锝旓即]|[cC锝冿迹][hH锝堬绩][aA锝侊肌][tT锝旓即][iI锝夛缉][dD锝勶激]|[cC锝冿迹][hH锝堬绩][aA锝侊肌][tT锝旓即][sS锝擄汲]|[cC锝冿迹][oO锝忥集][mM锝嶏辑][mM锝嶏辑][aA锝侊肌][nN锝庯籍][dD锝勶激]|[cC锝冿迹][oO锝忥集][mM锝嶏辑][mM锝嶏辑][aA锝侊肌][nN锝庯籍][dD锝勶激][sS锝擄汲]|[cC锝冿迹][oO锝忥集][nN锝庯籍][tT锝旓即][eE锝咃讥][nN锝庯籍][tT锝旓即][hH锝堬绩][aA锝侊肌][sS锝擄汲][hH锝堬绩]|[cC锝冿迹][wW锝楋挤][dD锝勶激]|[dD锝勶激][eE锝咃讥][lL锝岋棘][iI锝夛缉][vV锝栵级][eE锝咃讥][rR锝掞疾][iI锝夛缉][eE锝咃讥][sS锝擄汲]|[dD锝勶激][eE锝咃讥][lL锝岋棘][iI锝夛缉][vV锝栵级][eE锝咃讥][rR锝掞疾][yY锝欙脊]|[dD锝勶激][eE锝咃讥][lL锝岋棘][iI锝夛缉][vV锝栵级][eE锝咃讥][rR锝掞疾][yY锝欙脊][pP锝愶及][oO锝忥集][lL锝岋棘][iI锝夛缉][cC锝冿迹][yY锝欙脊]|[dD锝勶激][eE锝咃讥][lL锝岋棘][iI锝夛缉][vV锝栵级][eE锝咃讥][rR锝掞疾][yY锝欙脊][sS锝擄汲][tT锝旓即][aA锝侊肌][tT锝旓即][eE锝咃讥]|[eE锝咃讥][nN锝庯籍][dD锝勶激][pP锝愶及][oO锝忥集][iI锝夛缉][nN锝庯籍][tT锝旓即]|[eE锝咃讥][nN锝庯籍][dD锝勶激][pP锝愶及][oO锝忥集][iI锝夛缉][nN锝庯籍][tT锝旓即][iI锝夛缉][dD锝勶激]|[eE锝咃讥][nN锝庯籍][dD锝勶激][pP锝愶及][oO锝忥集][iI锝夛缉][nN锝庯籍][tT锝旓即][sS锝擄汲]|[eE锝咃讥][nN锝庯籍][vV锝栵级]|[eE锝咃讥][nN锝庯籍][vV锝栵级][eE锝咃讥][lL锝岋棘][oO锝忥集][pP锝愶及][eE锝咃讥][hH锝堬绩][aA锝侊肌][sS锝擄汲][hH锝堬绩]|[eE锝咃讥][nN锝庯籍][vV锝栵级][iI锝夛缉][rR锝掞疾][oO锝忥集][nN锝庯籍][mM锝嶏辑][eE锝咃讥][nN锝庯籍][tT锝旓即]|[eE锝咃讥][xX锝橈几][aA锝侊肌][cC锝冿迹][tT锝旓即][iI锝夛缉][dD锝勶激][eE锝咃讥][nN锝庯籍][tT锝旓即][iI锝夛缉][tT锝旓即][yY锝欙脊]|[eE锝咃讥][xX锝橈几][eE锝咃讥][cC锝冿迹][uU锝曪嫉][tT锝旓即][aA锝侊肌][bB锝傦饥][lL锝岋棘][eE锝咃讥]|[eE锝咃讥][xX锝橈几][eE锝咃讥][cC锝冿迹][uU锝曪嫉][tT锝旓即][aA锝侊肌][bB锝傦饥][lL锝岋棘][eE锝咃讥][sS锝擄汲]|[fF锝嗭鸡][eE锝咃讥][aA锝侊肌][tT锝旓即][uU锝曪嫉][rR锝掞疾][eE锝咃讥][fF锝嗭鸡][lL锝岋棘][aA锝侊肌][gG锝囷姬]|[fF锝嗭鸡][eE锝咃讥][aA锝侊肌][tT锝旓即][uU锝曪嫉][rR锝掞疾][eE锝咃讥][fF锝嗭鸡][lL锝岋棘][aA锝侊肌][gG锝囷姬][sS锝擄汲]|[fF锝嗭鸡][eE锝咃讥][aA锝侊肌][tT锝旓即][uU锝曪嫉][rR锝掞疾][eE锝咃讥][pP锝愶及][oO锝忥集][lL锝岋棘][iI锝夛缉][cC锝冿迹][yY锝欙脊]|[fF锝嗭鸡][eE锝咃讥][nN锝庯籍][cC锝冿迹][eE锝咃讥]|[fF锝嗭鸡][eE锝咃讥][nN锝庯籍][cC锝冿迹][eE锝咃讥][tT锝旓即][oO锝忥集][kK锝嬶极][eE锝咃讥][nN锝庯籍]|[fF锝嗭鸡][eE锝咃讥][nN锝庯籍][cC锝冿迹][iI锝夛缉][nN锝庯籍][gG锝囷姬]|[fF锝嗭鸡][eE锝咃讥][nN锝庯籍][cC锝冿迹][iI锝夛缉][nN锝庯籍][gG锝囷姬][pP锝愶及][oO锝忥集][lL锝岋棘][iI锝夛缉][cC锝冿迹][yY锝欙脊]|[fF锝嗭鸡][iI锝夛缉][lL锝岋棘][eE锝咃讥][rR锝掞疾][oO锝忥集][oO锝忥集][tT锝旓即]|[fF锝嗭鸡][iI锝夛缉][lL锝岋棘][eE锝咃讥][rR锝掞疾][oO锝忥集][oO锝忥集][tT锝旓即][sS锝擄汲]|[fF锝嗭鸡][iI锝夛缉][lL锝岋棘][eE锝咃讥][sS锝擄汲][yY锝欙脊][sS锝擄汲][tT锝旓即][eE锝咃讥][mM锝嶏辑][rR锝掞疾][oO锝忥集][oO锝忥集][tT锝旓即]|[fF锝嗭鸡][iI锝夛缉][lL锝岋棘][eE锝咃讥][sS锝擄汲][yY锝欙脊][sS锝擄汲][tT锝旓即][eE锝咃讥][mM锝嶏辑][rR锝掞疾][oO锝忥集][oO锝忥集][tT锝旓即][sS锝擄汲]|[hH锝堬绩][aA锝侊肌][nN锝庯籍][dD锝勶激][lL锝岋棘][eE锝咃讥][rR锝掞疾]|[hH锝堬绩][aA锝侊肌][nN锝庯籍][dD锝勶激][lL锝岋棘][eE锝咃讥][rR锝掞疾][iI锝夛缉][mM锝嶏辑][pP锝愶及][lL锝岋棘][eE锝咃讥][mM锝嶏辑][eE锝咃讥][nN锝庯籍][tT锝旓即][aA锝侊肌][tT锝旓即][iI锝夛缉][oO锝忥集][nN锝庯籍]|[hH锝堬绩][aA锝侊肌][nN锝庯籍][dD锝勶激][lL锝岋棘][eE锝咃讥][rR锝掞疾][nN锝庯籍][aA锝侊肌][mM锝嶏辑][eE锝咃讥]|[hH锝堬绩][aA锝侊肌][nN锝庯籍][dD锝勶激][lL锝岋棘][eE锝咃讥][rR锝掞疾][rR锝掞疾][eE锝咃讥][vV锝栵级][iI锝夛缉][sS锝擄汲][iI锝夛缉][oO锝忥集][nN锝庯籍]|[hH锝堬绩][aA锝侊肌][nN锝庯籍][dD锝勶激][lL锝岋棘][eE锝咃讥][rR锝掞疾][vV锝栵级][eE锝咃讥][rR锝掞疾][sS锝擄汲][iI锝夛缉][oO锝忥集][nN锝庯籍]|[iI锝夛缉][dD锝勶激][eE锝咃讥][nN锝庯籍][tT锝旓即][iI锝夛缉][tT锝旓即][yY锝欙脊]|[iI锝夛缉][mM锝嶏辑][pP锝愶及][lL锝岋棘][eE锝咃讥][mM锝嶏辑][eE锝咃讥][nN锝庯籍][tT锝旓即][aA锝侊肌][tT锝旓即][iI锝夛缉][oO锝忥集][nN锝庯籍]|[lL锝岋棘][eE锝咃讥][aA锝侊肌][sS锝擄汲][eE锝咃讥]|[lL锝岋棘][eE锝咃讥][aA锝侊肌][sS锝擄汲][eE锝咃讥][pP锝愶及][oO锝忥集][lL锝岋棘][iI锝夛缉][cC锝冿迹][yY锝欙脊]|[lL锝岋棘][eE锝咃讥][aA锝侊肌][sS锝擄汲][eE锝咃讥][sS锝擄汲]|[mM锝嶏辑][oO锝忥集][dD锝勶激][uU锝曪嫉][lL锝岋棘][eE锝咃讥]|[mM锝嶏辑][oO锝忥集][dD锝勶激][uU锝曪嫉][lL锝岋棘][eE锝咃讥][sS锝擄汲]|[nN锝庯籍][aA锝侊肌][tT锝旓即][iI锝夛缉][vV锝栵级][eE锝咃讥][sS锝擄汲][eE锝咃讥][sS锝擄汲][sS锝擄汲][iI锝夛缉][oO锝忥集][nN锝庯籍]|[nN锝庯籍][aA锝侊肌][tT锝旓即][iI锝夛缉][vV锝栵级][eE锝咃讥][sS锝擄汲][eE锝咃讥][sS锝擄汲][sS锝擄汲][iI锝夛缉][oO锝忥集][nN锝庯籍][iI锝夛缉][dD锝勶激]|[nN锝庯籍][aA锝侊肌][tT锝旓即][iI锝夛缉][vV锝栵级][eE锝咃讥][tT锝旓即][aA锝侊肌][rR锝掞疾][gG锝囷姬][eE锝咃讥][tT锝旓即]|[nN锝庯籍][aA锝侊肌][tT锝旓即][iI锝夛缉][vV锝栵级][eE锝咃讥][tT锝旓即][aA锝侊肌][rR锝掞疾][gG锝囷姬][eE锝咃讥][tT锝旓即][iI锝夛缉][dD锝勶激]|[nN锝庯籍][aA锝侊肌][tT锝旓即][iI锝夛缉][vV锝栵级][eE锝咃讥][tT锝旓即][hH锝堬绩][rR锝掞疾][eE锝咃讥][aA锝侊肌][dD锝勶激]|[nN锝庯籍][aA锝侊肌][tT锝旓即][iI锝夛缉][vV锝栵级][eE锝咃讥][tT锝旓即][hH锝堬绩][rR锝掞疾][eE锝咃讥][aA锝侊肌][dD锝勶激][iI锝夛缉][dD锝勶激]|[nN锝庯籍][eE锝咃讥][tT锝旓即][wW锝楋挤][oO锝忥集][rR锝掞疾][kK锝嬶极]|[pP锝愶及][aA锝侊肌][tT锝旓即][hH锝堬绩]|[pP锝愶及][aA锝侊肌][tT锝旓即][hH锝堬绩][sS锝擄汲]|[pP锝愶及][oO锝忥集][lL锝岋棘][iI锝夛缉][cC锝冿迹][iI锝夛缉][eE锝咃讥][sS锝擄汲]|[pP锝愶及][oO锝忥集][lL锝岋棘][iI锝夛缉][cC锝冿迹][yY锝欙脊]|[pP锝愶及][rR锝掞疾][oO锝忥集][fF锝嗭鸡][iI锝夛缉][lL锝岋棘][eE锝咃讥][iI锝夛缉][dD锝勶激]|[pP锝愶及][rR锝掞疾][oO锝忥集][fF锝嗭鸡][iI锝夛缉][lL锝岋棘][eE锝咃讥][rR锝掞疾][eE锝咃讥][vV锝栵级][iI锝夛缉][sS锝擄汲][iI锝夛缉][oO锝忥集][nN锝庯籍]|[pP锝愶及][rR锝掞疾][oO锝忥集][jJ锝婏吉][eE锝咃讥][cC锝冿迹][tT锝旓即]|[pP锝愶及][rR锝掞疾][oO锝忥集][jJ锝婏吉][eE锝咃讥][cC锝冿迹][tT锝旓即][hH锝堬绩][oO锝忥集][mM锝嶏辑][eE锝咃讥]|[pP锝愶及][rR锝掞疾][oO锝忥集][jJ锝婏吉][eE锝咃讥][cC锝冿迹][tT锝旓即][iI锝夛缉][dD锝勶激]|[pP锝愶及][rR锝掞疾][oO锝忥集][jJ锝婏吉][eE锝咃讥][cC锝冿迹][tT锝旓即][sS锝擄汲]|[rR锝掞疾][eE锝咃讥][cC锝冿迹][eE锝咃讥][iI锝夛缉][vV锝栵级][eE锝咃讥][tT锝旓即][iI锝夛缉][mM锝嶏辑][eE锝咃讥]|[rR锝掞疾][eE锝咃讥][cC锝冿迹][eE锝咃讥][iI锝夛缉][vV锝栵级][eE锝咃讥][tT锝旓即][iI锝夛缉][mM锝嶏辑][eE锝咃讥][uU锝曪嫉][tT锝旓即][cC锝冿迹]|[rR锝掞疾][eE锝咃讥][cC锝冿迹][eE锝咃讥][iI锝夛缉][vV锝栵级][eE锝咃讥][dD锝勶激][aA锝侊肌][tT锝旓即][uU锝曪嫉][tT锝旓即][cC锝冿迹]|[rR锝掞疾][eE锝咃讥][cC锝冿迹][iI锝夛缉][pP锝愶及][iI锝夛缉][eE锝咃讥][nN锝庯籍][tT锝旓即]|[rR锝掞疾][eE锝咃讥][cC锝冿迹][iI锝夛缉][pP锝愶及][iI锝夛缉][eE锝咃讥][nN锝庯籍][tT锝旓即][sS锝擄汲]|[rR锝掞疾][eE锝咃讥][cC锝冿迹][oO锝忥集][nN锝庯籍][cC锝冿迹][iI锝夛缉][lL锝岋棘][eE锝咃讥]|[rR锝掞疾][eE锝咃讥][cC锝冿迹][oO锝忥集][nN锝庯籍][cC锝冿迹][iI锝夛缉][lL锝岋棘][iI锝夛缉][aA锝侊肌][tT锝旓即][iI锝夛缉][oO锝忥集][nN锝庯籍]|[rR锝掞疾][eE锝咃讥][cC锝冿迹][oO锝忥集][nN锝庯籍][cC锝冿迹][iI锝夛缉][lL锝岋棘][iI锝夛缉][aA锝侊肌][tT锝旓即][iI锝夛缉][oO锝忥集][nN锝庯籍][pP锝愶及][oO锝忥集][lL锝岋棘][iI锝夛缉][cC锝冿迹][yY锝欙脊]|[rR锝掞疾][eE锝咃讥][gG锝囷姬][iI锝夛缉][sS锝擄汲][tT锝旓即][rR锝掞疾][yY锝欙脊][rR锝掞疾][eE锝咃讥][vV锝栵级][iI锝夛缉][sS锝擄汲][iI锝夛缉][oO锝忥集][nN锝庯籍]|[rR锝掞疾][eE锝咃讥][tT锝旓即][eE锝咃讥][nN锝庯籍][tT锝旓即][iI锝夛缉][oO锝忥集][nN锝庯籍]|[rR锝掞疾][eE锝咃讥][tT锝旓即][eE锝咃讥][nN锝庯籍][tT锝旓即][iI锝夛缉][oO锝忥集][nN锝庯籍][pP锝愶及][oO锝忥集][lL锝岋棘][iI锝夛缉][cC锝冿迹][yY锝欙脊]|[rR锝掞疾][eE锝咃讥][tT锝旓即][rR锝掞疾][iI锝夛缉][eE锝咃讥][sS锝擄汲]|[rR锝掞疾][eE锝咃讥][tT锝旓即][rR锝掞疾][yY锝欙脊]|[rR锝掞疾][eE锝咃讥][tT锝旓即][rR锝掞疾][yY锝欙脊][pP锝愶及][oO锝忥集][lL锝岋棘][iI锝夛缉][cC锝冿迹][yY锝欙脊]|[rR锝掞疾][eE锝咃讥][vV锝栵级][iI锝夛缉][sS锝擄汲][iI锝夛缉][oO锝忥集][nN锝庯籍]|[rR锝掞疾][oO锝忥集][uU锝曪嫉][tT锝旓即][eE锝咃讥]|[rR锝掞疾][oO锝忥集][uU锝曪嫉][tT锝旓即][eE锝咃讥][sS锝擄汲]|[rR锝掞疾][oO锝忥集][uU锝曪嫉][tT锝旓即][iI锝夛缉][nN锝庯籍][gG锝囷姬]|[rR锝掞疾][oO锝忥集][uU锝曪嫉][tT锝旓即][iI锝夛缉][nN锝庯籍][gG锝囷姬][pP锝愶及][oO锝忥集][lL锝岋棘][iI锝夛缉][cC锝冿迹][yY锝欙脊]|[rR锝掞疾][uU锝曪嫉][nN锝庯籍][tT锝旓即][iI锝夛缉][mM锝嶏辑][eE锝咃讥][hH锝堬绩][oO锝忥集][mM锝嶏辑][eE锝咃讥]|[rR锝掞疾][uU锝曪嫉][nN锝庯籍][tT锝旓即][iI锝夛缉][mM锝嶏辑][eE锝咃讥][hH锝堬绩][oO锝忥集][mM锝嶏辑][eE锝咃讥][iI锝夛缉][dD锝勶激]|[rR锝掞疾][uU锝曪嫉][nN锝庯籍][tT锝旓即][iI锝夛缉][mM锝嶏辑][eE锝咃讥][hH锝堬绩][oO锝忥集][mM锝嶏辑][eE锝咃讥][rR锝掞疾][eE锝咃讥][aA锝侊肌][lL锝岋棘][pP锝愶及][aA锝侊肌][tT锝旓即][hH锝堬绩]|[sS锝擄汲][eE锝咃讥][sS锝擄汲][sS锝擄汲][iI锝夛缉][oO锝忥集][nN锝庯籍]|[sS锝擄汲][eE锝咃讥][sS锝擄汲][sS锝擄汲][iI锝夛缉][oO锝忥集][nN锝庯籍][rR锝掞疾][eE锝咃讥][fF锝嗭鸡]|[sS锝擄汲][eE锝咃讥][sS锝擄汲][sS锝擄汲][iI锝夛缉][oO锝忥集][nN锝庯籍][rR锝掞疾][eE锝咃讥][fF锝嗭鸡][iI锝夛缉][dD锝勶激]|[sS锝擄汲][eE锝咃讥][sS锝擄汲][sS锝擄汲][iI锝夛缉][oO锝忥集][nN锝庯籍][sS锝擄汲]|[sS锝擄汲][uU锝曪嫉][bB锝傦饥][sS锝擄汲][cC锝冿迹][rR锝掞疾][iI锝夛缉][pP锝愶及][tT锝旓即][iI锝夛缉][oO锝忥集][nN锝庯籍][iI锝夛缉][dD锝勶激]|[sS锝擄汲][uU锝曪嫉][bB锝傦饥][sS锝擄汲][cC锝冿迹][rR锝掞疾][iI锝夛缉][pP锝愶及][tT锝旓即][iI锝夛缉][oO锝忥集][nN锝庯籍][rR锝掞疾][eE锝咃讥][vV锝栵级][iI锝夛缉][sS锝擄汲][iI锝夛缉][oO锝忥集][nN锝庯籍]|[tT锝旓即][aA锝侊肌][rR锝掞疾][gG锝囷姬][eE锝咃讥][tT锝旓即]|[tT锝旓即][aA锝侊肌][rR锝掞疾][gG锝囷姬][eE锝咃讥][tT锝旓即][aA锝侊肌][gG锝囷姬][eE锝咃讥][nN锝庯籍][tT锝旓即]|[tT锝旓即][aA锝侊肌][rR锝掞疾][gG锝囷姬][eE锝咃讥][tT锝旓即][iI锝夛缉][dD锝勶激]|[tT锝旓即][aA锝侊肌][sS锝擄汲][kK锝嬶极]|[tT锝旓即][aA锝侊肌][sS锝擄汲][kK锝嬶极][iI锝夛缉][dD锝勶激]|[tT锝旓即][aA锝侊肌][sS锝擄汲][kK锝嬶极][sS锝擄汲]|[tT锝旓即][oO锝忥集][oO锝忥集][lL锝岋棘]|[tT锝旓即][oO锝忥集][oO锝忥集][lL锝岋棘][sS锝擄汲]|[uU锝曪嫉][rR锝掞疾][iI锝夛缉]|[uU锝曪嫉][rR锝掞疾][iI锝夛缉][sS锝擄汲]|[uU锝曪嫉][rR锝掞疾][lL锝岋棘]|[uU锝曪嫉][rR锝掞疾][lL锝岋棘][sS锝擄汲]|[wW锝楋挤][oO锝忥集][rR锝掞疾][kK锝嬶极][sS锝擄汲][pP锝愶及][aA锝侊肌][cC锝冿迹][eE锝咃讥]|[wW锝楋挤][oO锝忥集][rR锝掞疾][kK锝嬶极][sS锝擄汲][pP锝愶及][aA锝侊肌][cC锝冿迹][eE锝咃讥][hH锝堬绩][oO锝忥集][mM锝嶏辑][eE锝咃讥]|[wW锝楋挤][oO锝忥集][rR锝掞疾][kK锝嬶极][sS锝擄汲][pP锝愶及][aA锝侊肌][cC锝冿迹][eE锝咃讥][iI锝夛缉][dD锝勶激]|[wW锝楋挤][oO锝忥集][rR锝掞疾][kK锝嬶极][sS锝擄汲][pP锝愶及][aA锝侊肌][cC锝冿迹][eE锝咃讥][rR锝掞疾][oO锝忥集][oO锝忥集][tT锝旓即]|[wW锝楋挤][oO锝忥集][rR锝掞疾][kK锝嬶极][sS锝擄汲][pP锝愶及][aA锝侊肌][cC锝冿迹][eE锝咃讥][sS锝擄汲])$).+$",
      "not": {
        "enum": [
          "project", "projects", "project_id", "project_home",
          "workspace", "workspaces", "workspace_id", "workspace_home", "workspace_root",
          "runtime_home", "runtime_home_id", "runtime_home_realpath",
          "native_target", "native_target_id", "native_thread", "native_thread_id", "native_session", "native_session_id",
          "session", "sessions", "session_ref", "session_ref_id",
          "chat", "chats", "chat_id", "task", "tasks", "task_id", "agent", "agents", "agent_id",
          "endpoint", "endpoints", "endpoint_id", "route", "routes", "routing", "target", "target_id", "target_agent", "recipient", "recipients",
          "handler", "handler_name", "handler_implementation", "adapter_implementation", "implementation",
          "adapter", "adapter_name", "adapter_revision", "adapter_version",
          "adapter-name", "adapter-revision", "adapter-version",
          "adapter.name", "adapter.revision", "adapter.version",
          "adapterName", "adapterRevision", "adapterVersion", "ADAPTERName", "锛★激锛★及锛达讥锛睳ame",
          "handler_version", "handler_revision", "handler-version", "handler-revision",
          "handler.version", "handler.revision", "handlerName", "handlerVersion", "handlerRevision",
          "AdapterImplementation", "NativeSessionID", "NATIVESessionID", "锛肌锛达缉锛讹讥SessionID",
          "identity", "Identity", "exact_identity", "exact-identity", "exact.identity", "exactIdentity",
          "revision", "Revision", "registry_revision", "registry-revision", "registry.revision", "registryRevision", "REGISTRYRevision", "锛诧讥锛э缉锛筹即锛诧脊Revision",
          "capability_profile", "capability_profiles", "capability_profile_id", "capability_profile_revision",
          "capability-profile", "capability-profile-id", "capability-profile-revision",
          "capability.profile", "capability.profile.id", "capability.profile.revision",
          "capabilityProfile", "capabilityProfileId", "capabilityProfileRevision", "CAPABILITYProfileID", "锛ｏ肌锛帮肌锛缉锛缉锛达脊ProfileID",
          "profile_id", "profile_revision", "profile-id", "profile-revision",
          "profile.id", "profile.revision", "profileId", "profileRevision",
          "command", "commands", "executable", "executables", "module", "modules", "tool", "tools",
          "url", "urls", "uri", "uris", "network", "environment", "env",
          "cwd", "path", "paths", "filesystem_root", "filesystem_roots", "file_root", "file_roots",
          "filesystem-roots",
          "lease", "leases", "fence", "fencing", "fence_token",
          "retry", "retries", "retry_policy", "reconciliation", "reconcile", "reconciliation_policy",
          "retry-policy",
          "retention", "retention_policy", "feature_flag", "feature_flags", "policy", "policies",
          "routing_policy", "delivery_policy", "lease_policy", "fencing_policy", "capability_policy", "feature_policy",
          "delivery", "deliveries", "delivery_state", "delivery.state",
          "subscription_id", "subscription_revision", "subscription-id", "subscription-revision",
          "subscription.id", "subscription.revision", "subscriptionId", "subscriptionRevision", "SUBSCRIPTIONRevision", "锛筹嫉锛汲锛ｏ疾锛╋及锛达缉锛籍Revision",
          "received_at_utc", "received-at-utc", "received.at.utc", "receivedAtUtc",
          "receive_time", "receive_time_utc", "receive-time", "receive-time-utc",
          "receive.time", "receive.time.utc", "receiveTime", "receiveTimeUtc", "RECEIVETimeUTC", "锛诧讥锛ｏ讥锛╋级锛imeUTC",
          "content_hash", "content-hash", "content.hash", "contentHash",
          "envelope_hash", "envelope-hash", "envelope.hash", "envelopeHash"
        ]
      }
    },
    "dataObject0": {"type": "object", "maxProperties": 32, "propertyNames": {"$ref": "#/$defs/safePropertyName"}, "additionalProperties": {"$ref": "#/$defs/dataScalar"}},
    "dataArray0": {"type": "array", "maxItems": 32, "items": {"$ref": "#/$defs/dataScalar"}},
    "dataValue1": {"anyOf": [{"$ref": "#/$defs/dataScalar"}, {"$ref": "#/$defs/dataObject0"}, {"$ref": "#/$defs/dataArray0"}]},
    "dataObject1": {"type": "object", "maxProperties": 32, "propertyNames": {"$ref": "#/$defs/safePropertyName"}, "additionalProperties": {"$ref": "#/$defs/dataValue1"}},
    "dataArray1": {"type": "array", "maxItems": 32, "items": {"$ref": "#/$defs/dataValue1"}},
    "dataValue2": {"anyOf": [{"$ref": "#/$defs/dataScalar"}, {"$ref": "#/$defs/dataObject1"}, {"$ref": "#/$defs/dataArray1"}]},
    "dataObject2": {"type": "object", "maxProperties": 32, "propertyNames": {"$ref": "#/$defs/safePropertyName"}, "additionalProperties": {"$ref": "#/$defs/dataValue2"}},
    "dataArray2": {"type": "array", "maxItems": 32, "items": {"$ref": "#/$defs/dataValue2"}},
    "dataValue3": {"anyOf": [{"$ref": "#/$defs/dataScalar"}, {"$ref": "#/$defs/dataObject2"}, {"$ref": "#/$defs/dataArray2"}]},
    "dataObject3": {"type": "object", "maxProperties": 32, "propertyNames": {"$ref": "#/$defs/safePropertyName"}, "additionalProperties": {"$ref": "#/$defs/dataValue3"}},
    "dataArray3": {"type": "array", "maxItems": 32, "items": {"$ref": "#/$defs/dataValue3"}},
    "dataValue4": {"anyOf": [{"$ref": "#/$defs/dataScalar"}, {"$ref": "#/$defs/dataObject3"}, {"$ref": "#/$defs/dataArray3"}]},
    "dataObject4": {"type": "object", "maxProperties": 32, "propertyNames": {"$ref": "#/$defs/safePropertyName"}, "additionalProperties": {"$ref": "#/$defs/dataValue4"}},
    "dataArray4": {"type": "array", "maxItems": 32, "items": {"$ref": "#/$defs/dataValue4"}},
    "dataValue5": {"anyOf": [{"$ref": "#/$defs/dataScalar"}, {"$ref": "#/$defs/dataObject4"}, {"$ref": "#/$defs/dataArray4"}]},
    "dataObject5": {"type": "object", "maxProperties": 32, "propertyNames": {"$ref": "#/$defs/safePropertyName"}, "additionalProperties": {"$ref": "#/$defs/dataValue5"}}
  }
}
