{"schema_version":1,"adapter_name":"mailbox","adapter_version":"v1","event_type":"message_pointer_changed","source_event_id":"event1","source_cursor":"cursor1","observed_at_utc":"2026-07-19T00:00:00Z","source_time_utc":null,"subject":"mail changed","coalescing_key":"mailbox:one","observed_state":"unread","expected_outcome":"acknowledged","why_not_done":"not checked","next_unlock_action":"check thread","severity":"actionable","payload":{"count":1}}
